review,sentiment
nothing outta star another weird premise director movie cube time around two main character find home transported mysterious white void literally nothing outside small two story house intriguing sure thought comedic tone established movie get go extremely ill conceived need humour certainly problem humour eventually derived plight two hero final showdown definitely hoot really think movie would lot better stayed rooted reality beginning watching movie watched making feature dvd short trailer end almost totally devoid sillier comedic aspect making look like completely different slightly better movie last half hour movie thing really start come together similar way recent movie primer actor fine overdoing comedy shtick really quite believable normal moment probably ready write movie failed experiment midway point end keep watching past credit final scene ask explain,1
movie always broadway movie classic long still people sing dance act,1
hell saw matrix amazed spectacular movie ever made ever possesed wachowski brother film beyond br br plot argue basically film load talking get wrong problem talky film talking matrix reloaded pointless load drivvle would fight sequence lasted way long pointless drivvle another fight scene last long build biggest anti climax ever little bearded bloke talking load uncomprehensible bull minute br br also keanu reef give worst performance yet knew good actor beyond joke watch film order would seem got gradually worse went along god know performance like something gotta give keanu reef plank wood ever become actor br br splendor first film came massive dissapointment already seen first film suggest watch waste time utter pile turd br br,0
great character great acting great dialogue incredible plot twist plain language one best show ever seen life favor watch show regret show writes book sci fi,1
sure point making film looked made historical society shown local pistol pete museum first appears could beginning mad tv snl sketch joke punchline realize someone taking seriously story bad inclusion sas member seemed ploy worked get see film swear trailer listed every character film dead cowboy reason western fun atmosphere character brings feeling watching civil war rean actor dressed cowboy even worth digital video recorded,0
first review imdb com probably first ever written review film done accord class assignment think fact alone say something movie good thing seasoned journalist critic though seen fair share movie found particular film terribly painful watch necessary peace mind vent experience better imdb forced sit movie physically writhing inability connect dot sure would light end tunnel revelation explain samhe going movie ended enlightened dog several rewinds review certain scene still could conclude nothing sensible found wanting yell make sense anybody would recommend waste time probably want experience case bring crossword puzzle something get bored,0
well eyeboy must say plea end someone single try make fun especially someone seems intelligent favorite part post big bang bang good guy bad guy kimosabe suggest stick movie lotsa bang bang br br well said like action movie especially well done also like movie whole lot action long well done sorry secret lie fit category simply bad movie really see many non american film maybe spoiled realize bad foreign film really saw secret lie perhaps judge foreign movie different standard could day see secret lie could possibly one highest rated movie imdb hmm true scary br br jeremy barger bit midohio net new e mail,0
watch film soon eating br br said begotten stick rest life like based nihilistic philosophy life nothing man spasming ground paraphrase title sequence introduction likely contain intense grisly imagery ever see film br br dialogue image image describing cycle life film combination stark black white photography compounded truly creepy background sound work drive home maker message br br movie begin god portrayed bandaged obviously insane man slicing open torso straight razor subsequently dying filth death mother nature emerges corpse impregnate blood semen give birth man represented maggot human convulsing earth br br landscape barren waste populated hulking shrouded humanoid eventually happen upon mother nature man slew violent scene depicting rape nature destruction man humanoid proceed pound remains corps back ground cycle life begin anew br br actually rented blockbuster one night based cover art hype content definitely blockbuster type film expect narrative dialogue pulled punch intense imagery based dark subject br br give movie high mark filmwork audio think watching often like movie dark unique one exponentially expected,1
fortunate enough see last stop live moving picture film festival know moving picture film festival tour canadian made film canada told movie started world premiere verge getting american distribution deal added excitement br br big horror movie fan yes love scream trilogy well found rose mcgowan ten little indian type movie knew treat rose mcgowan biggest name actor actress entire festival br br best way describe without giving away much plot quite like scream certainly worth seeing set middle snowstorm filmed vancouver b c canada mountaintop motel add suspense rose mcgowan put great performance girl next door along rest cast happens end well thing say never guess ending br br sadly probably make mainstream north american theatre decent money maker rose mcgowan get chance see would recommend worse come worst always video br br gave,1
probably one film many commented undiscovered probably one masterpiece spanish cinema like buñuel master piece day could better visitation others film long time ago could midnight cowboy could also le amants du pont neuf realistic non spot look realistic trainspotting hard story place humour love obviously dramatic sense new social spanish cinema little diamond could resurrection italian neo realism mixed whit best ken loach film br br probably better film discover last year,1
typical mamet film delivers quiet evenly paced insight make confidence man joe mantegna good explored psychological study noted psychologist lindsay crouse slowly pull world usual nasty consequence cast includes number player found several mamet film steven goldstein jack wallace ricky jay andy potok allen soule william h macy usual good job loved lindsay crouse film often wondered become noted player become perhaps looking right place br br movie proceeds slow pace flat dialog yet maintains level tension throughout logically lead bang ending expect real let ending found uplifting satisfying love movie,1
may sentimentalist found movie truly moving first movie reduced tear recommend anyone gay str religious supporting co star jackie bisset stole show especially one liner nude scene superbly crafted well good taste shocking portrayal orientation reversal deprogramming instituted mormon church lead character shocked still go world nevertheless enjoyed movie tremendously definitely best gay film since torch song trilogy much better gay movie offering year fluffer,1
movie good think tiffany amber beautiful liked movie anyone tell get hold song movie even soundtrack possible least get name song respective singer tried look amazon com tried cd baby either browsed google get detail would appreciate someone could give answer question know song belong country music sung country artist need title name along singer would recommend movie rather song country loving person,1
unexpected pleasure heard nothing film br br shameful since warrant wider audience br br wonderfully humane story social message gently told although admittedly predictable resolution solidly acted principal beautifully photographed muted color floating grey capture nostalgic tone film br br recent foray chinese film shower road home one le exciting one hope continue exploring china people amazing canvas film maker king mask highly recommended starting point anyone similarly interested recent chinese film br br,1
take say lightly seen many many film reviewed great deal print tell film single funniest scene ever seen movie might want listen lot diversity opinion make incredibly stupid movie funny get well blame much scene speak come minute mark involves dead convict shackled john candy point found film dumb confusing beginning lose scene came laughed hard peed pant movie ever done project began going berserk supposed sctv movie remember announced time went cast whittled john candy joe flaherty eugene levy also must regime change universal shot upon released shown nearly zero theater watching second time listened theme song actually flaunt incomprehensible plot lyric relaxed logic nerve figured going aside aforementioned routine going berserk many hilarious scene recommend almost stooge flick except much funnier director david steinberg razor sharp timing must laughing candy basically charge never funnier plot device explanatory scene thrown window absolutely run wild flaherty levy follow effortlessly plot plot like animal house plot yeah script uneven little slow start know however well appreciate full sctv style craziness transpires stupid stupid purpose need remember see see discover funniest scene time,1
okay big video game buff game house dead really famous enough make movie sure went far actually put quick video game clip throughout movie though justifying particular scene violence dozen dozen game look exactly hand bottom screen supposedly holding whatever weapon goo ing kind alien walking dead sniper whatever case may br br interesting premise house dead lot college kid loaded college kid kid able pay fisherman something like ride miss boat trying get island supposed rave year first thing come mind house dead watching become increasingly clear modern horror movie become nothing exercise coming creative way get lot scantily clad teenager exactly situation least case fact way rave excuse way girl dressed look badly place running around wood cute little halter top least thought dressed occasion br br clint howard tellingly interesting character film far delivers absolutely awful performance greatness overshadows every actor movie stand well known actor change accent movie rarely effective howard show equally flat well known actor pretend hardened fisherman raspy voice year breathing salty air even rasp well sounded like eating cinnamon roll shooting accidentally inhaled powdered sugar something real tough clint expected agree part mess br br get island movie temporarily turn one friday th movie took place camp crystal lake lot teenager played actor way old part getting naked killed nudity impressive guess let consider something minute kid pay almost two grand get island go rave year find one say well want beer even guy pulled stack hundred wallet get think anything found full bar single solitary person sight input director uwe boll alcohol notice party came consists one br br start drinking minding fact whole party seems vacated island one girl go dark wood find everyone dragging one girl one guy reluctantly along guy girl stay behind get smashed decide would great idea strip quickie alone like expected find island empty rest people came gone little would privacy since one else around brilliant br br thing everyone hated judging review read movie yes intersplicing shot video game movie mostly order show yes movie faithful directly copying video game sure stupid idea imagine thought little nugget worse matrix style bullet time scene thrown first time point found pretentious cheesy movie like shot like though something original noticeable technique shot rather dramatic meaning creation kind tension film br br one thing make zombie film scary get edge seat slowly relentlessly coming living human much faster getting tired running place run terrifying shortage thing fight zombie first two done right movie kid terrified lot place run since island since caught ride smuggler find heavily armed mean strongly mean people everything machine gun hand grenade remove tension impending walking dead br br call techno slasher scene since rave never happened guess since uwe boll thought people going disappointed hearing techno music movie one scene right middle human fighting living dead amazingly enough turn something music video techno music blasting shot edited together faster faster nothing blur gory shot mostly frame long second flashing across screen time speed techno music clever guess place horror movie completely remove sense scariness tension even gross effect see one thing long enough react watching shot fly across screen wondering hell director thinking decided would good idea put something like movie br br seen lot people compare movie resident evil mostly claiming copy premise exactly right appreciate least case resident evil man made virus turned people walking dead able infect people changing way vampire turn others vampire day later also clearly inspiration movie bad house dead single original thing except somewhat moronic idea putting quick shot video game based case forget really think much better movie obviously say know much game based title movie poster deserve much better movie unfortunately think often case horror movie really kind sad movie come obviously advertised hold barred horror film scariest thing entire movie closing shot suggests possibility sequel,0
okay fan nightmare series everyone say worst seen freddy revenge wtf worst movie pretty decent stick freddy story cool daughter etc etc br br found excited remember saw dvd box set instantly skipped sequence quite lot though like lisa zanes hand dream demon freddy claw lezlie dean holding knife lisa zane baseball bat doc hand freddy head exploding br br truly loved movie wish whole movie last minute br br way minute ten,1
episode really hoping mention canceled everything connected show including actor dumped along toxic waste middle ocean somewhere never seen series really dire br br program listed genre comedy best misleading hard believe ben elton could write something bad maybe point lot input writer everything connected episode even laughed br br oh believe ardal hanlon actually stopped hero started instead decision making skill obviously impaired day perhaps simply read realise poor script blessed get wrong hero masterpiece million time better piece junk br br annoy even bet get dvd release well many great tv series getting released,0
exactly new story line romantic comedy make concept work young man john cusack drop dead gorgeous woman kate beckinsale keep meeting chance wonder meant although promised others oddly enough still feel soul mate somewhere little sappy place viva la love romantic almost obligated riveted favorite scene cusack ground snow start falling finale almost sweet deserving one cusack deeper role hell could smitten beckinsale notable support provided jeremy piven molly shannon john corbett play worst role ever seen hand eugene levy quirky funny watch soul mate,0
shockingly bad movie literally gasped first time seeing blue screen puppet imagine worst blue screen special effect ever saw make somehow far worse combine poorly made rubber play doh puppet look like something semi retarded pre school art class add screeching yngwie malmstein esquire melodic metal guitar solo stuff way loud last way long overall film absolutely awful make feeder look like rashomon one worst movie ever seen every quantifiable metric spiraling dismally downward much like waterlogged turd perpetual slow whirlpool broken rest stop toilet still though film like actium maximus missed bad movie conesseuirs even looking clip youtube someplace movie bit eye opener stomach ride think director may mentally ill though bit debasing watching discus project get sense truly belief created something wonderful guess star war kid gonzo filmmaker mess,0
nothing director juvenile fantasy come life movie nothing excuse director actor play kissy face attractive young woman would otherwise never give time day br br plot simple direction nonexistent movie drag actor director writer narrator narrates fooled x rating nudity minimal gore,0
amusing humor fall flat decent acting quite atrocious movie simply hit miss guaranteed amuse year old boy niche br br child actor movie unfunny making family comedy tend problem beverly angelo rise material give funny dare say human performance midst mediocrity,0
docteur petiot starring michel serrault brutal story brutal man doctor heals sick occupied france even ability compensate yet prey weakest amidst populace imagery cinematography superb lend additional macabre feeling complex story perfect psychopath seductive altruistic intelligent caring calculating murderous movie certain forgotten soon viewer kudos mr serrault chilling portrayal,1
james franco totally cool movie handsome charismatic genuinely open vulnerable sincere kind way tristan screening folk back pouty sullen whole james dean thing think true blind spot proof positive tremendous talent film carry different sort weight entirely unique performance bittersweet really moving line journal cut like knife sense sharp intelligence observation behind word tone everything carry action suspense well grim bit gallows humor like two actor great deal blonde girl totally gorgeous man hysterical twisted tough guy stoicism thug seemed little sketchy mini point really film totally solid franco way cool around,1
get lazy director movie instead setting scene creative way relies boring old zombie clichés br br two unarmed lead get college step van surround zombie yet neither lead bitten bothered direct decent fight scene see lead shove way step br br sometimes zombie limp others run like wind really convenient director set anything like without bothering continuity behaviour zombie br br careful planning lot inspiration movie could much better,0
course could obviously co opted several aspect excellent movie also based sensational french case self described doctor world health organization murdered family finally unmasked fraud emilio refers son monster sings radio car hang park bench specializes investment scheme defraud family friend directly lifted time came year nobody life bad movie pretty good good acting writing whereas vincent time much subtle character seems sense ethic even though time get twisted knot protagonist seems devoid character save winning look charm seriously part used x ray show mother law cancer bilk money father utilizes subtle twist scam avoid eviction fancy home failing pay lease time almost much guy shame whatsoever fact like lead stepfather poor schmuck get fired humiliated face disappointment family friend feel forced invent shiny new life vincent time thus one could feel tension mounting nobody life violent conclusion coming one thing nobody life time definitely lacked love interest apart protagonist trusting wife hard understand sexy babysitter able fascinate ensnare emile degree ignored danger natural curiosity allowed lay bare le carefully constructed con given reservation mentioned pretty good movie found entertaining long something touching similar element go might deeper intellectually spiritually satisfying strongly suggest time,1
almost year event asked come mind day people would probably comment thing sight plane crashing collapse twin tower score people killed act terrorism heroism mixed together etc everyone alive time never forget day yet u memory although moving personal level come extraordinary film give everyone lose friend family member chance become involved personal level lost film need seen,1
italy produced lot really great original horror film certainly one first thing notice danse macabre style film shot beautiful black white due director antonio margheriti use lighting film almost look like could german expressionistic horror film coupled horror filled plot line ensures danse macabre film truly capture essence horror course fact beautiful barbara steele appears film harm matter good news continues film get flex acting muscle film made famous plot aware time released incorporates great edgar allen poe follow alan foster writer accepts bet poe lord blackwood spend entire night latter creepy old castle everyone spent night previously died hero meet previous wager taker br br nowadays horror film tend focus much shot result much beauty left genre refreshing therefore see film many shot incredibly beautiful female side couple wearing see skirt personal favourite shot smoke creeping door first antonio margheriti film even seeing one obvious one italy premier director also interesting fact screenplay co written another italian great django creator sergio corbucci plot meander little much time always enough atmosphere hand make sure film never becomes boring fact always intriguing even plot slows ensures thing way danse macabre utilises haunted house theme well done original help keep story eerie possible whole fan italian cult cinema want miss little gem,1
guessing matter fan car luv sound dodge challenger growl along road noise chevy make scream ecstasy tear round corner blast sound classic vehicle burst flame explodes biggest car enthusiast stretch imagination really rev engine denying importance transport cinema even said invention train one biggest influence early cinema looking window almost like moving picture idea transported different time space car remains popular luved even got genre carsploitation genre genre focus purely beauty car effect porn car porn talking rather nasty documentary channel men actually sexual intercourse car whatever float car guess moving whilst running empty quite pornographic vanishing point richard c sarafian instance close ups car motion bump curve mean car main focus film fact car become character later objectified fetishised much woman fact maybe even holy holy car something every car film besides one background simply beautiful  work art question br br saying incredible car way given character actually start sympathising car spoiler  notably scene car wrecked burnt spoiler become almost convention carsploitation genre evil plymouth fury christine john carpenter satan custom lincoln mark iii car elliot silverstein nifty little mini cooper italian job peter collinson friendly volkswagen beetle love bug robert stevenson course car death race paul bartel even wacky race character ironically however emphasis car often take human character certainly case running empty one human character blind character drive car hearing rather sight sort dimension rest much stock character stereotypical australian teenager big hair annoying accent none would look place neighbour especially kylie minouge look like give damn car racing crashing like really watching wrong genre br br car scene certainly selling point film best thing got going fast fast talking rather annoying technique film seem use record car speeding around mph speed oooh film car zooming along top speed real time  fancy editing trick got speed check crash check check check whilst car crashing everywhere la incredibly blue brother john landis car crash film certainly crash would seem use gunpowder something similar build car one little hit kaboom flame kind reminded thriller cruel picture bo arne vibenius sense br br simply awesome scene especially start end quite scene slow everything done opinion fail add much film note exploding car needed however couple exception great scene  spoiler especially attempted rape scene br br man film boy film full car vroom vroom vrooming around outback couple tit thrown good measure recommend little film anyone even keen cyclist  great film switch brain sit back leather chair put full volume give luvs luvs  bruuuuum p  amazon selling £  real bargain although dvd lack special feature whatsoever,1
gotta say usually like horror movie never seen however one pathetic gory taste used gory gut wrenching type particular movie lame acting horrible yet corny pun intended one liner cute sequel scarecrow slayer even worse yes probably first came huge rave people liked movie like ring exorcist emily rose come movie like make movie like scarecrow seem childish want movie pas time pick one special effect cheesy heck seeing low budget movie kind see would come kind remind movie child corn independent movie rock time want see scarecrow killing people corncob sequel scarecrow going movie would,0
good example film spite low rating worth watching story engaging take long chemistry nicole kidman ben chaplin grab attention acting first class character represented well sometimes feel like director decide drama romantic comedy ben chiller portrayal law abiding shy englishman porn magazine hidden bedroom creates plenty moment laugh look nicole kidman eye offering john first taste intimacy long time time actor especially nicole kidman give comedy quite expertly dramatic slant,1
searching month finally found dvd say damn well worth wait rush rio may well greatest rock dvd existence joking incredible fuss sound crappy true however make concert unwatchable find make feel like actually rio watching concert audience one reason love dvd make feel like actually also geddy alex neil never better form geddy vocal flawless alex guitar playing still incredible neil absolutely word say camera work concert good must say gave u good look everything going stage audience kudos cameraman anyways enough raving go watch rush rio amazed guarantee br br,1
one worst movie seen long time story boring dialogue atrocious acting hammy sure movie result film school homework project certainly played like one even particularly successful central conceit trying appear single continuous take whooshing horizontal camera pan cheap unoriginal way hiding cut,0
