review,sentiment
laughed hard since granny got caught wringer say one pothead hilarious quasi spoof val lewton george romero walking dead movie come love loath depending personal taste year br br story young actor pair play ghoulish prank rest troupe one spooky night visit cemetery island artistic director alan pretend bring dead back life conducting highly stylized ritual br br way much screen time misspent amateur dialog includes lame witticism melodrama kind unnecessary filler commentary alan stop irritating laughter way much action kick come close end film worth wait br br saw one late night local station television program ran film much like one one scared age might laugh way bitter end probably reason nowadays people still wear striped hip hugger,0
wimpy stuffed shirt armand louque blandly played veteran character actor dean jagger rare lead role join group researcher want find destroy secret technique creating zombie armand fall lovely claire duval fetching blonde dorothy stone us meek sap get armand colleague clifford grayson hopelessly wooden robert noland marry furious used spurned claire armand us knowledge voodoo get revenge sound exciting well sure starter victor halperin static non direction let meandering uneventful talk ridden story plod along excruciatingly slow pace worse yet halperin crucially fails bring tension atmosphere momentum hideously tedious proceeding mostly blah acting largely insipid cast help matter george cleveland hearty general duval e alyn warren irascible dr trevissant manage enliven thing bit welcome refreshing hammy histrionics drippy stock film library score painfully obvious stagebound set crude cinematography pretty lousy unimpressive well fact feeble excuse fright feature crummy even uncredited starkly staring eye great bela lugosi alleviate brain numbing boredom dismally dull dud,0
guess first movie made aware term cult flick totally bad movie help like movie richard boone made better joan van arc staying late watching movie make think much one,1
perhaps generation film come along perfection railway child film timeless classic directed performed beautifully depicts worthwhile humanity climax conquest love faith cruel injustice every performance gem though bobbie stand like judy garland dorothy jenny agutter make impossible u imagine anyone else role br br world better film child today would much better watching br br course like many young men generation fell hopelessly love jenny agutter hold strong great good fortune meet day ago bewitching smile voice like dripping honey still send weak knee first year ago,1
may biased author novel hungry bachelor club self published screenplay written good friend hungry bachelor fred dresch inspiration character marlon film pleased trailer hope see film entirety comment jorja fox play delmar youngblood character stellar carry bulk emotional vehicle fine form done better look like real people hardly formula driven thankfully drive statement racial prejudice home gracefully heartfelt,1
north south book ii ultimate tv series spotting cameo appearance highly entertaining gene kelly james stewart elisabeth taylor olivia de havilland robert mitchum even johny cash¡ series come close achievement ever seen anyone looking like lincoln dick smith prosthetics made hal holbrock powerful performance even crafted costume jaw dropping location everything clear nowadays excellent bright tv series desperate housewife lost north south still one kind miss david carradine portrayal ultimate villain may call violent husband worth viewing maybe character situation stereotyped admit positive side clearly cast shadow glad finally available dvd spain,1
second beginning title explains show u beginning end human race set long matrix existed short anime written wachowski show u world could lay infront u distant future set turn st century second renaissance delf issue common human behaviour greed power control vanity etc br br use robot artificial intellegence slave servents common among science fiction fantasy story second renaissance exeption concept however instead simple man v machine layout story explains struggle machine put struggle acceptance world ruled human matrix film show u human perspective short animation tell side story br br second renaissance part answer many question brought original matrix film war broke sky blackend led use human battery also introduces u machine city called may relevance upcoming matrix revolution film br br give away much story want ruin experience perspective viewer however recommend anybody interested world matrix simply anybody interested japanese animation anime br br,1
men love police movie filled action shooting chase etcetera br br boy let watching short unsatisfying movie seen hostage bank surrounding yet bad guy shoot multiple officer innocent people simply stay line fire without getting hit due kevlar br br shot hundred shot going back bank dumb hostage lock safe door bad guy went stupid director think br br okay shot fake documentary good seeing film got thought police get decent shooting course many cop swat real long break truly bad,0
snake train movie rented due pure amusement thought movie snake plane enjoyable action film obviously film maker wanted cash success low budget effort minute snake train almost unbearable witness keep pausing film something entertain due lack happening film throughout duration film never fully explained girl curse keep coughing green purplish goo constantly endless boring dialog two main character brujo alma discussing get rid curse appreciate low budget film making truly picky movie open genre budget snake train truly one worst horror film ever seen writer acid something end film woman suddenly turn giant snake importantly earth able devour train br br bottom line snake train movie need avoided cost intrigued like title movie seriously bad let put snake rest br br,0
sat tv hoping name would worth time dear gussie whoever thought script worth producing basic idea excellent execution appallingly bad constantly illogical sequence scene ending almost laughably melodramatic poor rock hudson wanders understandably confused look slightly sagging face look like bad b movie,0
movie really nothing besides admittedly well crafted series tense sequence punctuated inevitable gotcha end really character development real plot speak skeletal motivation character anything trudge forward unavoidable doom excuse show creepy ghost kid seems gotten family cat mixed ectoplasm ghost mom long black hair hanging face kind like ring take bunch cardboard cut two dimensional excuse human character br br english language version grudge equivalent cinematic junk food satisfying momentarily really ought living br br recommended,0
thanks jymn magon creating disney best cartoon ever show improved much year kid like thought rip ducktales favorite disney thing time like grandmoffromero later though good great reading review decided give another chance bought dvd set watched whole pilot first day got pleasantly surprised still favorite episode although series live end disc knew going top tenner br br character complex charming favorite got wildcat absolutely hilarious sweet boot next favorite baloo best pilot show see ol jymn built show around kit cloudkicker baloo best relationship series louie jim cummings perfect job impersonating original voice rebecca made laugh pretty hard believe baloo eventually marry finally hero molly although least favorite still like think cute character much better webby ducktales villain original karnage air pirate always crack kahn ice cold ruthless thembrians always least amusing br br said story range hilarious time wait bear romance red chimp nothing short touching old man seaduck paradise lost fun funny exciting adventure search ancient blunder favorite bell klangs favorite episode anyway talespin disney best aside gummi bear reason gb decent amount favorite character cubbi t enough wildcat end talespin remains classic bottom line th best cartoon ever,1
amen magsel lot confusion going first know movie purchasing henry cele star every one bought movie thinking miniseries letdown would comedy young girl raped david hasselhoff spelling ok popcorn tv believable film english accent love story movie supposed young man rise military power slave ship captain getting jiggly english maiden looking daddy br br paid movie would call police would crime,0
wow believe first one post comment great movie br br although movie seemed interesting enough real thing attracted one matt lillard granted people probably either think caffeine happy plain suck age generation watched guy many time one favorite one movie big shot main star kind like slc punk another great lillard film br br baiscally storywise usual heist movie twist anything start amount craziness also notable movie another great actor named vincent onofrio appreciated person film industry woman movie newcomer bad although know hired mainly accent nude scene br br game jack v jill v bob want reap reward share one try get eachother kill timebomb waiting explode matt show true prowess scheming jack initially start whole scheme vincent woman play couple art thief need money due lack business vince character bit deranged skitz throughout movie add intensity film br br surprise left right well welcomed ending non cliche make feel happy well maybe depends type ending like movie kept interested besides fact matt great movie highly recommend anyone like movie critic probably like movie watch movie cause like movie anyway,1
year old daughter asked watch movie cable tv someone saw revenge nerd movie theater found movie extremely predictable remake nerd simply replaced dork drove crazy able predict precisely would happen scene cast cute especially amanda bynes br br screenwriter chad creasey ashamed writing obvious remake early flick title simply revenge dork perhaps sequel revenge dork,0
well take j simpson american soldier turned american bus driver decides rescue passenger incase one else going arte johnson absolutely straight role tour guide know want admit trouble combine lorenzo lama one three baby faced bad boy intend kidnap heiress leave busload people die dessert got action plot twist lot drama everyone good seeing lama baddest bad boy really blew mind much believable overbearing bad guy wanted kidnap heiress rape woman humiliate guy tried stop evidently long cultivated good guy image believe year old lorenzo tight jean really want miss,1
honestly fail understand people love show much friend mine watch since like sci fi tried watch along since plot show sounded promising truth really boring show thing keep awake show video game like cgi effect complete overuse muppets note call muppets actually really look like muppets like alien br br speaking muppets make effect horribly overused show guy could best described alien dwarf hybrid pale girl look like cheesy vamp girl got floating potty mouth frog alien feel unnecessary furthermore even point feel distracted whole storyline lost astronaut br br every episode also much stand alone creator show directed way every episode almost feel like whole show least point see main character muppets whole plot main character getting back earth way much pushed background point acting also quite bad br br conclusion want good sci fi look somewhere else even real sci fi begin opinion since show aimed fantasy element puppetry weird dream going want see muppets suggest watch muppet show feel glad abomination show come end br br way anyone dejavu concept living spaceship ohyeah thats right doctor started concept almost year ago show like collection sci fi leftover script event abandoned good reason picked horrible show,0
columbo episode one better perhaps one personal favorite cast includes rosemary baby john cassavetes maestro wife played blythe danner gwyneth paltrow mom mother law played myrna loy one america greatest leading actress film time anyway disagree anybody criticizes film episode one favorite excellent cast superb job performing love watching columbo beloved dog never name series time episode focus classical music hollywood bowl one l attraction course columbo becomes interested classical music anything else involving crime,1
debating movie chose inglourious basterds due amazingly high imdb rating must say disappointment expected certain amount gratuitous violence also expected lot witty dialog got huge dosage former nearly enough latter felt shortchanged ratio violence plot important think movie get totally wrong plot believable really entertaining either save time money believe rating say gory violent taste modern mass,0
ok film calling one best movie ever sitting thinking hell f story sux story diolouge quite plain artisticly nothing great acting nothing real standing want pretend arty say like real view say like explain,0
seeing aristocats special edition two pack fox hound decided buy since film childhood favourite br br aristocats classic definitely might five star classic fun film make good evening entertainment somewhat light refreshment darker serious disney classic aristocats try light hearted musical comedy think succeeds br br storyline really make much sense think plot particularly strong certainly weak animation background bit scratchy place typical disney film rustic old fashioned charm br br aristocats strongest point character music humour music memorable try getting everybody want cat head hurry song written sherman brother also music jungle book one song called never felt alone going film sadly make final feature shame think would fit well br br character unforgettable thomas malley voiced phil harris basically baloo feline form eva gabor give duchess warm maternal feel kitten voice actually sound like child actor imitating voice child secondary character dozen yet still end understanding personality edgar villainous butler play similar role cruella de vil comical scary often ending funny situation even though bad guy still lovable br br two british goose abigail amelia really cracking along crazy drunk uncle also like dog tend argue leader could go spoil tell aristocats funny entertain everyone without resort rudimentary toilet humour br br bottom line aristocats might disney crowning achievement even strongest film award tie rescuer many adventure whinnie pooh enjoyable romp sure entertain looking dazzling work art might better watching bambi want fun night aristocats way go charming lovable film impossible dislike enjoy besides good film cat seen villain,1
teen agers go old deserted farm house left one dead grandfather unaware several murder decade earlier grandfather made pact devil good harvest guy thought something better sell soul man grandson friend set next sacrifice reason never explained stereotypical teenage son girlfriend black guy white girlfriend two lesbian battle three killer scarecrow tricked like nearly fun sound mostly lot chit chat ball kicking dope smoking lead actor complaining never knowing parent camera work atrocious shaky maybe done hand held camcorder scene maybe good thing since scarecrow look like came kid birthday party apparently could hire two people play three scarecrow best movie seen low budget independent horror movie one pathetic cast crew seems made bunch people knew never acted intention acting thousand dollar believe movie cost make weekend free time hand even lesbian skinny dipping scene lame br br think amusing also writing sequel film one even bothered adding imdb br br rate highly skinny dipping scene matter lame may,0
believe actually sat thru entire film friend rented jacket made sound good defense jacket correct supposed haunted room someone slept overnight jacket sounded like par freddy jason maybe shining farther truth br br fan minimalist surrealist film may enjoy looking good fright movie couple thrill go rent jason v freddy iv much better night,0
brian keith cole wlikerson richard jaeckel wade matlock make excellent villain love intimidating local brutal way possible sneer sexily suggestion might humane way achieve end pity goody goody glenn ford get way,1
saw dvd apartment paris exchange program laughed hard cuz much going movie happened u mean yeah sure pretty clichéd still true know saying br br think related quiet guy italian xavier observer group anyway wish hot roommate like cecile de france seems like cool chick movie real saw hosting cannes festival last month br br thinking wanna go barcelona next summer seeing movie gotta check sequel came france,1
know got idea snake plane put bluntly pay see movie really want waste minute life either catch cable get free pick netflix blockbuster pay rent pay rent one stupid individual acting awful plot awful everything awful except snake whether real cgi generated look pretty good said still movie one worst movie ever seen even nude dancing scene pretty bad actually fast forwarded sat warn,0
movie tyrannus gladiator brought back dead summon tyrannus gladiator must brought back dead tyrannus learn hour also called demonicus add much needed depth screenplay call question assumption identity psychology br br spirit tyrannus accomplishes little list killing people saying repetitive phrase latin possessing body college guy us magic mind control helmet college boy willingly put head several point movie take put back br br maria performs oral sex poor man sean willian scott tyrannus wear rollerball glove tyrannus green backlighting reason apparently sitting next cg fire ancient concrete tunnel century like utter misfortune br br movie empty hurt see,0
movie truly show farce hypocrisy indian society try show one side story side story hidden emotional mental abuse indian child movie show br br indian parent culpable following destroying individuality child making completely dependent parent early age child grow adult physical look remain child mind since everything provided great indian parent child automatically feel need work hard something learn basic human communication human being apart parent br br b show many indian parent try prevent kid making friend going prevent anything start making grow adult br br reason selfishness indian parent expect child take care grow old saving reach age cry loud grown old dependent child since done great service bringing world taking care making intellectually weak br br indian parent age dilapidated body health financially completely insecure feel absolutely need take care since expect kid take care br br west opposite happens people start planning age retirement retire financially secure br br indian parent nothing sort since like said brought kid world better investment br br victim indian parent sure countless indian kid like grown physically still struggling life continue pestering year old cry loud help time br br movie show one side story utter piece junk,0
woody allen best one sharpest pen around make acute observation wrap around punch line like nobody else however worst movie stench pretentiousness unfortunately melinda melinda stench opening closing set one intriguing idea four friend sit restaurant discussing whether essence life comedy drama help settle argument one man relates beginning story asks two men arguing one comic playwright dramatic playwright whether story comedy tragedy two men continue story movie play story weave first heard film understanding tell exact story genre comedy drama change look would interesting however story share one main element side element entirely different story major plot difference drama stiffly scripted pretentious really work self parody point failed element prevent audience feeling emotional investment character comedy story moment success still short fleeting farrell obviously meant stand woody could played character much believably without adding woody stutter hand tick woody best woody someone else try playing character modeling recognizable actor type thing pull audience story br br favorite woody allen movie make leave theater little bit lighter spirit walked one made wish could get money back,0
man white suit like right jack take dim view labor capital alec guinness scientific genius eccentric one never gotten university degree due err accident college laboratory manages push various industrial lab textile industry film begin michael gough company gough memorable moment trying impress would father law cecil parker showing ship shape firm run lunch parker parker daughter joan greenwood gough get message regarding problem lab unexpectedly large budget problem read huge expenditure due guinness experiment choke coffee br br guinness go work parker firm repeat trick gough parker discovers greenwood discovered guinness working convinces parker continue experiment legally result guinness assistant apparently figured make artificial fiber constantly change electronic bond within molecular structure intent purpose fiber remain tact good textile made never fade get dirty wear last forever br br guinness support female shop steward chief see guinness selling rich explains done turn everyone clothes last forever need new clothes soon parker fellow textile tycoon led gough ernest theisinger wonderful performance howard marion crawford equally panic stricken may end business seek suppress invention greenwood corner although parker sort sympathizes guinness try get news discovery public br br end guinness defeated science well greed end film seeing error calculation guess one day may still pull discovery br br brilliant comedy argument suppression valid one point difficulty making textile shown heat thread high temperature actually enable end material united nothing show cloth stretch owner get fat contract owner get thin believe people would want one set clothing ever happened fashion change new style cloth made color white making guinness look like white knight told color dye would added earlier process effect chemical reaction maintain structure textile br br ala science paper film hypocrisy labor capital modern industry brilliant question mention keep bothering validity suppressing guinness invention,1
although many audio recording great musician like jascha heifetz survive cinematic televised record limited indeed musical offering like shall music rare gem modern eye ear one quibble plot perceptive viewer put film unique delight proper perspective plot designed appeal young old audience era remains enjoyable day important aspect experience watching classic film see eye moviegoer era br br must take issue reviewer complains film black white feel obliged report student express reservation juvenile complaint reflect limited historical perspective teacher offer educational opportunity explain unique quality black white photography place cinematic history color fact get way good storyline music example black white photography john ford stagecoach like still photograph ansel adam artistic masterpiece br br heifetz wooden could disagree want blatant emotional posturing go rock concert role classical musician like heifetz move audience heifetz emotion conveyed playing body language rare ability extract every emotional nuance music transfer listener listener moved artist br br incidentally one reviewer asked seeing heifetz youtube playing st movement tchaikovsky violin concerto frank mchugh audience film carnegie hall shall music carnegie hall even greater treasure many great classical artist prime blessed film producer least limited instance chose showcase artist still era totally overwhelmed lowest common denominator tripe get today,1
read book open fresh interpretation director give medium film letter reproduction literature particular film happy holocaust occurred russia neighboring country finally received attention nazi particularly cruel russian russian jew read history see monument built smolensk nearby region understand movie many kept silent spoken br br certainly time chronicled hope story come high time,1
independent b w dv feature consistently shock amazes amuses ability create insane situation find humor interest hilarious ridiculous stuff yet absurd much film heart reality keep film grounded keep entire piece drifting complete craziness therein lie real message film survive world gone mad seems heart film insane wall thing get leon yr old paperboy protagonist always try keep together like child forever trying catch balloon floating away everything work best everyone want br br acting film could went far top exceptional cast really keep piece cohesive van meter perhaps best bunch performance shine absurd diseased tic character film overlook sudden outburst see real person underneath br br majkowski true genius take utmost ridiculous plot twist keep real script cast help keep whole thing afloat true testament skill majkowski involved film grating plot character never work nerve majkowski taken film could abrasive repugnant somehow given heart humor unique film missed br br,1
believe dumb movie truly storyline written keira knightley mother ruin movie extreme straight dull absurd make absolutely sense whatsoever br br movie lagged bad especially beginning story kept going everyday flirt often time seeming like threesome movie annoying deadbeat couple poet wife complete total drunk start wife sleep around men make end meet poet pervert thrives cheap boo woman wife waaayyyyyy quickly becomes friend former childhood lover played keira suddenly get jealous knowing full well two lover since kid something seem right mean come get program lady expect br br bottom line former lover meet new wife embracing get jealous former woman lover get married husband get jealous bombard crazy drunk couple home crazy husband call police end going court man attempted murder charge summed nutshell br br movie moment quality good acting cillian murphy cannot believe watched complained movie family member watching fell asleep decided give chance stuck first instinct,0
