review,sentiment
saw back finally released apparently orion picture bankruptcy think movie released couple year earlier br br problem remembering detail partly seen long time remember dull movie kept debating whether walk store interesting engaging rd rate america graffiti imitation br br none performance make worth watching either one biggest disappointment since local newspaper reviewer gave high rating,0
still believe wes craven responsible piece crap movie worse deadly friend plot stupid acting mediocre film deadly dull know wes craven hate debut last house left absolute masterpiece genre like probably turkey get wrong really like movie real torture sitting watching,0
saying movie extremely hard follow frustrating sit putting mildly also saying current available print dark dreary scratchy abysmally edited painfully dubbed seemingly censored almost unwatchable shape also correct film dire need good remastering full uncut original negative seeing reasonably atmospheric director award catalonia film festival might actually worth trouble maybe impossible tell current condition kind movie actually start fairly interesting discount completely senseless pre credit opening sequence involves deranged cat killing snake loving little girl named gerda girl mom carla mónica randall laid eyeliner little bit splash gasoline around garage torch brat seemingly crazy young gerda go visit estranged photographer ex boyfriend mario john cihangir caffari vacation work desperate get away carla begs employer set assignment assignment scowl sorry head door well mario assigned photograph witch mountain somewhere pyrenees believe get destination get sight hottie beach named delia patty shepard snap picture taking bikini top slightly peeved claim single writer two flirt decide would swell idea went trip mountain together stop place pack bag mario suddenly hears loud sinister music delia claim hearing thing br br two begin trip mountain taking stop local inn spend night encounter weird partially deaf crazy eyed innkeeper victor israel delia claim someone spying window next day trance wanders mountain eventually located mario hop jeep run finding someone steal wheel forced walk piece eventually finding jeep undamaged foot small ancient seeming abandoned village almost like someone trying intentionally lure well see exactly happened village encounter friendly old woman named zanta ana farra claim person still living let stay home mario take picture abandoned city develops eerily full people slightly creeped delia begin leave get stuck treacherous fog pull camp night rest movie voodoo doll black cat transforming sexy woman satanic ritual performed lady bra deadly fall cliff yeah coincidentally carla estranged wife turn one witch take place semi darkness quite honest know hell going time inconclusive open ending additional slap face anyone suffer rest senseless mess br br honestly thing stand really good first actress shepard great barbara steele kind dark mysterious beauty also excellent music score credited fernando garcia morcillo chanting song aided immensely making film atmospheric location work fairly decent said print ugly make lick sense proceed caution one,0
like end day movie like b movie hoping would like movie br br could ignore poor effect often atrocious music cringe inducing line could ignore unexplained event fact movie constantly relies deus ex machina excusable given subject matter could ignore fact people fight hunger try reach world peace bad guy none thing kill movie kill movie plain simple boring nothing actually happens almost scene movie designed push movie creator moral viewer cost actually coherent story kind suspense br br looking entertaining b movie look elsewhere movie boring,0
routine suspense yarn sociopath dillon give sperm clinic human reproduction start harrass life woman antony husband mancuso extremely predictable far fetched undecided tone way lose time one make baby instead,0
lady gentleman show begin documentary film structured three chapter one chronologically arranged first present classical physic link einstein second study depth quantum physic enters string theory last reveals everything theory difficult concept used introduced simple way daily object although must believe without checking scientist even scientist film masterpiece fabulous technique way produced really import story story,1
stopped movie minute change know maybe swedish french cannes commenter sleepy place previous reviewer held forth born raised ny lived near san francisco quarter century holland love good independent film much next movie enthusiast word funny see funny thinking made mistake said word said funny nope mistake type humor say really much life consider appreciation film symptom please ever write another review tendency believe unanimous even review mine figured might actually able save someone else boredom anticipation laughter never materializes smile twice though started movie stopped line,0
suppose like pure action find suppose find gorgeous blonde designed screwed find suppose want find couple extra baddie headed extra extra baddy boss meat nasty end find br br overall routine stuff good guy come top big time extra ordinary circumstance br br marvel good guy armed pistol kill dozen bad guy machine gun shooting point blank range missing goody even get time reload pistol amid hail machine gun bullet br br ho hum,0
astonishing people saw art saw poorly filmed shaky hand held camera generally badly acted unscripted mess seemed like high school film project kid experimenting black white film making injecting mound poetry place story art film make watched theatre people starting fit giggle u included endless stupidity self indulgent meandering mess believe seem endless finished candy popcorn would walked theatre two dozen people packed left looking something interesting,0
sat watching episode kept glancing clock waiting something happen hour wound thought really going give u big pop end nothing whole family huddled around christmas tree like something hallmark channel fade black br br perhaps one poorest season finale ever seen nothing drum excitement next season thing thrown sort incentive watch next season ambiguous nugget offered agent harris pawing sub sandwich guy new york looking get one guy new jersey wow really would never expect something like mobster edge seat br br almost seems like trying get everyone lose interest start plot line end disappearing show ever seen tease hint rarely deliver br br arab hang bing keep throwing front u magically nothing happens br br paulie knee cap kid tony promised mother nothing would happen son poof gone wind br br many meandering drug montage christopher going endure please get arrested overdose something interesting br br one show used looked forward watching forgetta bout,0
recap band five young american men left platoon hit hard ardenne offensive wwii get assignment forward outpost look enemy activity really bad condition physically mentally think struck gold outpost abandoned plush mansion full food enemy activity odd hostile odd seems like german squad equally bad condition want nothing surrender br br comment based novel guess novel much better story seem translate well big screen indeed different war movie much mental pressure wartime fighting battle almost feel scene must full suspense full uncertainty unknown element fall flat movie suspenseful different many way absurd many time people act insane reason unclear best hinted br br mental pressure fails come main building piece entire story thought story fell good interesting keep edge really send message actually nothing br br cast interesting many young actor turned star beginning career acting good stellar character also fell absurd zone much feel due story character need time space pace given novel given going halfway definitely good enough br br,0
watched several day film shooting movie summer end result two scene movie location sylvan lake black hill bring wagon stop wagon etc dakota youth looked forward seeing movie disappointed local buffalo herd culled shooting scene real yes doris animal hurt filming think ending copied jack nicholson shining great western social comment class high noon real western drama used social statement like blackboard jungle rebel without cause youth,1
diego armando maradona still remains best football player game offered athlete artist documetary world cup forever live memory every football fan around world tremendous unbelievable goal scored country england absolutely point diminishing star although dont undersand spanish appreciate argentine narrator actually cry happiness barely express emotion anything wrote senseless difficult comprehend reader watch know mean,1
crystal voyager strange documentary eccentric surfer living australia american birth george greenough surfed photographed friend recently dolphin australia year using various invented camera either strap back board boat mid teamed surf mag editor budding film maker david elfick create visually interesting tale life photography minute feature crystal voyager result even audience bit puzzled film neither surf ing movie surf movie george swim child zippy board real surfboard offset tedious droning george occasionally dry droll actually funny like almost setting fire falling something spectacular power glide wave ran minute set pink floyd music sydney opera house opened also contained cinema crystal voyager booked arty sporty oz pic default became hit opera house ticket cost far movie ticket audience flocked see film excuse sydney opera house film record business low budget attraction local tourist wanted tell neighbor seen show created myth film huge crowd puller reputation spread result teamed fantasy cartoon fantastic planet trippy run uk europe double feature ran coastal cinema crowd rather nonplussed recently george emerged lord fly style another well photographed sea adventure called dolphin glide offer viewer dive swim wild dolphin byron bay eccentric min short even eccentric min george short met collective yawn medium pubic january make crystal voyager fluke year ago however special oz surf night outdoor cinema last year people turned turn every night see anything summer season film damned thing fluked another box office binge many actually enjoyed much open debate likely plain puzzled mad film astonishing reputation elfick however since gone onto stellar career major producer director many lauded australian international film look worry starstruck undercover rabbit proof fence love limbo clear present applause achievement george however still floating around somewhere droning away looking something else film drop camera,0
widely unknown strange little western mindblowing colour probably material used johnny guitar guess trucolor something make blood drip look like shining ruby nearly surrealistic scene twisted action character something different far masterpiece paid attention little gem western encyclopedia,1
read novel kite runner based wife daughter thought movie fell long way short book prepared take word movie good great good accurately portray havoc created soviet invasion afghanistan convincingly show intolerant taliban regime followed rate c first b second human story afghan american returned country rescue son childhood playmate well done count particularly told book far convincing movie exciting part film however kite contest kabul later mini contest california cannot equaled book wager money,1
god incredible movie reminded much similar scene mel gibson movie soldier company lost cut scene pearl harbour british officer say ben affleck american like god help nation go war america br br put movie together would enough bullshit fertilise entire sahara desert br br story cut battalion may real enough movie could done without american preachy jingoistic propaganda attached audible groan cinema mentioned scene pearl harbour kidding either lost battalion however really class br br american think unbeatable inspired bravery actually cringed damn near puked swill spewed throughout diarrhoeic disaster movie br br fighting scene well made star script manure wrapped even brightly coloured ribbon still manure writer james carabatsos also wrote screamer hamburger hill mercy heartbreak ridge someone please shoot writes garbage br br director russell mulcahy australian god shame,0
low budget mostly name actor campy horror flick supposed type movie kept edge seat kid staying late watch cable liked horror scene movie,1
excellent anime movie well animated good intricate plot good music understand may think little long think good length animation good traditional anime br br three character br br way use tenkai masterly example body double showing location add ominous tone movie design tenkai good way look monk end scene armour wearing br br old man andou earth likable character jiro meet turning point movie br br sanpei satsuma shinobi infiltrated tenkais clan save jiros life twice stay background movie though really one hero movie br br plot plot good traditional without unoriginal historical time acted interesting meiji restoration treasure sought tenkai restore shogunate jiro find us help anti shogunate force overthrow shogunate br br way tenkai trick jiro interesting sort hamlet feel also sweet irony fact tenkai gotten jiro become shinobi think able kill end maybe firearm hand hand combat weapon br br plot death make mostly dark light moment see jiros childhood memory good dark intricate plot br br music opening theme example good electric guitar drum occasionally piece use believe taiko drum sure br br lot good music like one played traveling iga shinobi believe piece called numatou incredible flute flute might pan flute probably shakuhachi br br end theme kamui komoriuta calm delicate vocal beautiful song general br br animation br br animation good perfect blood run character sometimes appear orange transition interesting think transition nice one example nice transition jiro iga shinobi running sunset background music playing transition simple effective nice feeling br br final word think plot animation music character make one best anime movie ever seen,1
movie schlock despite lo fi production link troma production dark fable adult exploitation theme sugar cooky one wonder cast fallen prey said theme weird movie enticing visuals shadow contrast prominent definitely worth look especially fan warhol stylish decadence cruelty wickedness moral albeit twisted gleamed,1
originally aired abc movie week involves two young innocent female college student railroaded prison camp little southern town allowed phone call nobody know follows rape torture beating humiliation degradation leading disturbing conclusion br br tv version time grim nudity beating pretty tame overall feeling sleaziness wore one unrated version even worse plentiful nudity violence extreme one particularly disgusting sequence see cry female prisoner forced strip lesbian guard us yuck nothing wrong exploitation film one go brink get feeling filmmaker enjoy poor woman tortured degraded shoved face like supposed enjoy needlessly downbeat ending help br br giving acting good actually make movie harder watch sick sleazy film recommended,0
american come expect crapiness par course come horror unknown director directing unknown actor acting unknown writer truly expect suck suck becomes night success br br night success weekend month success blow start finish recommendation go knowing suck enjoy something better keep back way back burner entertaining way watching elderly cross busy street rush hour expect much almost never get hit actual car lot hoopla,0
definitely definitely worst film ever seen question asked contradictors opinion might argue title judged criterion others since independent low budget film c mon already  amateurism meager innovation horrifying br br agreeing everything said film example mind numbingly weak acting bad take another go shooting scene god damn thing found annoying total lack common sense script assuming thing existed production obvious absence dialogue respect viewer girl switched personality several time seemed show absolutely sing rationality even brain five relatively fit girl one slight female psychopath  gang br br thing regarded somewhat conquest title camera leaving van time thus viewer seeing everything inside rest film good idea executed exponentially dreadfully br br oh way movie nothing like blair witch project cloverfield title filmed hand held camera  effect trait used cleverly breathtaking case excuse inadequate cinematography,0
someone teach people made movie difference presenting multiple twist screwing audience even use hypnosis tool cover plot hole whenever find way scene say regressing past snapping think explains everything movie dishonest cheat last minute becomes full blown fiasco,0
nearly always case britain come entertaining successful sit com quiz show yank come along poach format produce grossly inferior version man house course exception rule yank version three company unwatchable braindead pap seem run forever prime example quantity non existent quality original hand fondly remembered gem savvy like fawlty tower pull plug precisely right time unlike episode hilarity three company came jo cute brilliant chemistry roper richard sullivan made look easy script whilst exactly oscar wilde standard consistently funny chrissy drop dead gorgeous woman walked face planet since dead sea merely feeling unwell nuff said,1
kid remember watching visiting friend uncle phil back dinosaur story silly cartoon dinosaur called rex voiced wonderful john goodman tell little boy dinosaur story dinosaur came back earth live explains part thing brought back along friend doctor professor villain film think might responsible back care kid might like personally cheesy john goodman probably decent thing poor,0
many negative review stay away joe stay quiet longer let injustice happen side heard yet br br elvis presley movie guilty pleasure simple reason perfect film pure relaxation think watch mean worry missing complex plot never proper plot start kick shoe grab beer sit back switch brain enjoy general wackiness catchy easy going rock n roll tune grooviest decade br br book stay away joe definitely fall bad good category like appreciate trash value ultimate camp experience bad almost surrealistic watch think possibly get worse surprise imaginable way end amazed new level stupidity know whether laugh cry nutshell love damn amusing generation actually made film like still give though hit bottom became instant bad movie classic,0
usual commenter website seeing underrated movie endeavour write comment remark fun watching movie perhaps cat everything wish could going post spoiler reveal plot thing really found amazing way manipulates people divine underrated movie lack argument usually go enjoy speak little go movie fun really enjoyed h stayed dark room must seen delight fade away let try critical thank reading,1
second time stopped video dvd part way br br willing give film benefit doubt first even though managed shallow clichéd stupid joyless plodding pretentious br br like school special directed weird grade nine kid think nobody understands creepy sad voice narration deluded adolescent would consider poetry singing really poor child suffering br br enough already especially morphed brazen clumsy insulting clockwork orange ripoff mention singing br br worst film ever seen certainly one felt least compelled sit recommend anyone,0
sort everbody see least br br glorify world show everyday person killed mained debased war person side eats sleep laugh cry,1
really enjoyed movie little difficult brother making stupid comment ever second movie enjoyed mostly used usual hk action film film like watch story line watch mindless action mindless action right get see jet li jump spin kick punch shoot make impossible jump dodge countless bullet true movie released broader audience li lethal weapon one reason rating movie dropped people probably expecting see movie polished north american film need remember hk film budget nearly high north american film style hk action film usually different usually requiring wire work lot want see good action film see try ignore dubbing br br rating,1
reading many review know movie people watching clearly one saw br br movie horrible acting primarily moore terrible woman cannot act nice tit act point come across actual character instead spoiled hollywood actress go beach play make believe boy br br movie ultimately hollywood make believe training sequence top politics top political correctness top combat scene guessed top mission get get without detected shoot many round make much noise possible course oh g jane wing man anytime br br premise good soon hollywood get hold end top gun tit br br expected commercial u film anymore much guess,0
hulk hit theater long dvd old incredible hulk tv show popped attempt cash craze saw similar occurrence year prior spider man cartoon appeared dvd coincide hero big screen debut company leap opportunity ride financial coattail hot brand br br fact picture never surfaced shelf wal mart featured hero clobbered box office summer say lot guess everyone involved would rather forget fair fantastic four bad everyone say let rephrase unentertaining negative review might suggest br br veteran television actor alex hyde white remember role lead way reed richards brilliant scientist along crew gain bizarre power outer space mishap left ability stretch contort body outrageous length future wife sue storm rebecca staab suddenly turn invisible brother johnny jay underwood may ignite poor ben grimm michael bailey smith lovable lug whose body morphs mass craggy orange rock br br friend becoming accustomed called upon rescue world certain chaos seems reed old colleague victor von doom joseph culp living name villainous jeweler ian trigger exactly helping old lady cross street either hero save day course like superhero movie question br br striking fantastic four amateurish virtually every aspect dialog lame tired sound like written junior high drama class acting unpolished make third rate afternoon soap opera look like shakespeare special effect surprisingly good considering minuscule budget still positively embarrassing moment human torch fully ignites body instance entire movie briefly turn cartoon hear production meeting oh one notice intrigued action mean really cartoon least give mannequin fire held string prior scene foursome come earth spaceship crash pure teen backyard fare crew simply found field lit vaguely spaceship like object fire remnant major disaster br br course whole lot work script fairly coherent story simplified reed ben decide go outer space simply drop storm house ask care join really easy sort thing require oh know year training expertise world writer seemed inspired underrated genius display full house rerun bad may nothing compare painfully clichéd dr doom pulled right awful superhero cartoon right evil laugh slamming clenched fist table punctuate remark comic book least fantastic four ever featured villain obscenely one dimensional br br ultimately fantastic four saved complete turkey damn innocent tell people involved little talent experience really tried know final result would embarrassing impression big break people would flock theater bear repeating virtually money work sure half eaten cool thing costume thing considered well many flaw finished product fair amount fun comic book fan,0
full length feature film world bridge found first minute bit slow movie absolutely perfect describing professional bridge player go earning living br br scene funny think non bridge player would get charm movie br br dress really beautiful pity movie black white imagine would look like colour way medium portrayed absolutely hilarious way earth bridge ever like br br watch soon tell friend,1
man navy comment indicated rare well filmed look navy lighter air lta activity lta crew justly proud convoy shadowed never lost ship submarine attack filming various na location give valuable glimpse type aviation long gone however first half movie beery relationship service pal meeting tom drake character mother getting drake leg fixed second film start second film mostly ltas action taking surfaced sub guy get killed much damage caused look fairly gritty realistic imagine shift southeast asia navy ltas never mind part really wild blimp used extract downed aircrew jungle jap shooting like mad shade vietnam except getaway oh leisurely blimp talking end feel good wwii drama unusual part war,1
