review,sentiment
caution several spoiler br br someday somewhere going post apocalyptic movie made stink unfortunately postman movie though give credit trying br br kevin costner play somebody credited postman actually postman wanderer mule wasteland western america devastated unspecified catastrophe trade isolated village performing shakespeare suddenly pack bandit called holnists self declared warlord west descend upon village costner visiting evil leader gen bethlehem patton draft costner much misery numerous effort break costner spirit escape thus ending lengthy section movie could told better three minute flashback br br finally get major premise escaped costner find abandoned mail truck delivers letter nearest town hoping get food pretense postman number village people led young ford larenz tate want get postman act sit well bethlehem bandit costner find unwitting unwilling leader band postman war holnists br br idea postman versus bad guy ridiculous sound holnists depend livelihood fact village prey isolated one another holnists destroy one village could stand victim united unite village must communicate one another working mail system would thus big step toward putting holnists business really make lot sense bethlehem would get medieval heroic mail carrier unfortunately bethlehem eventual defeat result village uniting instead old standby cliche one one brawl costner even real attempt community use mail work together solve problem mail seems standard hi aunt debbie stuff played maximum sentimental value br br postman one predictable movie shot shot ever seen purposely try ruin movie straining figure going happen next talking kind predictability requires effort knew going happen next whether wanted know lion prominently showcased eating people holnist bandit seeking escaped costner venture bush noise shocked lion eats bunch unoffending villager rounded shot firing squad one villager sings famous last word right shot immense lack surprise covered statue unveiled show exactly everyone knew going costner bending pick letter cutesy kid saw earlier movie man tell bethlehem sir take wife bethlehem run unsuspecting sod though person theater unsuspecting br br rank cloying sentimentality really undoes postman olivia williams playing costner lover abby worst served pours heart material give best effort make sound natural sincere try hard heart breaking nobody could ever made line gift postman give hope like candy pocket sound like anything syrupy pap another example scene mounted costner thunder past little boy ignoring proffered letter turn around stare seems like five minute thunder back pick letter costner pick first time real reason artifice try fails give u feeling elation dashing kid hope restoring br br schmaltz predictability unite end statue postman revealed sat thinking please tell going show statue cut back scene cutesy kid surely saccharine obvious even movie ala music swelled indeed cut back dreaded little boy smiling letter maiden aunt whisked away held head hand thought somebody shoot felt like thirty pound apple pie rammed throat br br gen bethlehem humanized villain normal standard issue post apocalyptic villain meanest toughest b valley bethlehem shown little nothing man inside try make feel important beating others although menace thereby sacrificed bethlehem credible way villain unfortunately patton overacts although told early bethlehem utterly destroyed last challenger five second hand hand combat bethlehem actual fighting skill shown end movie absolutely ludicrous br br acting otherwise pretty good costner done better razzie overreaction mentioned olivia williams impressive larenz tate ford sincere credible job james newton howard score competent though short epic standard movie going enough save film br br rating,0
thing worse surfer without wave film surfer without wave viewer love surfing film gigantic disappointment since total number minute surfing footage struggle reach three br br story slice life beached surfer waiting perfect wave wave j c sean pertwee aging super surfer flirting commitment girlfriend chloe catherine zeta jones find grown bliss woman love three old surfing friend turn convince hit beach looking monster wave bone yard trouble wave end film story dissipates meandering succession disconnected beach happening br br acting mostly mediocre sean pertwee comical moment mostly acting mundane ewan mcgregor decent drug dealing wild man far interesting peculiar character bunch probably funniest performance turned peter gunn terry turned corpulent body continual sight gag catherine zeta jones sexy usual character really enough meat show much acting ability br br really much comment rated real beach bummer,0
really wanted love film read book daughter loved book marvelous film far book book splendid film awful adaptation br br book sara honorable kind strong never anything spiteful get back anyone point book behaves prince regardless circumstance important part behaving like princess return unkindness behave honorably regardless treated br br book endures much touch life others people change behavior witnessed kindness ability endure without sinking spite vengefulness sara right simply right br br outside bakery come upon beggar girl poor hungry half dozen hot bun hungry give one bun wild looking little girl huddled doorstep bakery see ravenous girl watch gobble bun give another continues given think remember many br br baker watching window moved witnessed take beggar girl raise daughter people similarly influenced sara br br book father died man next door father partner looking father lose money man thrilled find sara take becky home raise daughter sara full inheritance course br br miss minchin chimney sweep fact remains post school humiliated sara told new guardian cruel treatment received sara speak miss minchin end miss minchin trying minimize treatment sara sara calm steadfast demeanor instructs miss minchin cruel br br comeuppance miss minchin continues miserable existence matter matter sara home guardian love dearest friend world becky intent purpose sister br br book love honorable behavior worst circumstance self control humility wonderful book film nothing capture true story message book wife disgusted wanted leave theater middle decided stick rewarded br br cannot life think reason film make alter excellent book bad direction perhaps influence ghastly screenplay book shirley temple acted know film far book character value recognize br br waste time buy book unforgettable even dad,0
always enjoy seeing movie make think drip feed answer audience revolver one film although many reviewer stated difficult follow bit concentration open mind got first time true compare mind muck like usual suspect memento right intelligent thought provoking film br br another thing really liked film damn beautiful every scene every camera angle seems thought age see know mean br br conclude watch open mind may enjoy well one ever said revolver everyone cent,1
like bad film thing steaming heap shaky cameraman horrible sound devastating acting waste second pile fifth grader could made better film first grader could written better script want real synopsis ugly chick neon bikini dancing way long disjointed plot made worse hideous acting location set even passable church scene take place dance studio oh yeah two tap dance number come blue br br oh total number naked breast even saved film add one trash heap,0
slasher around time cheesy rip offs older movie brain well done script reminded videodrome cheesy way said acting go effect make laugh called brain really turkey blood never shown opening sequence make movie worth watching hallucination really nicely done reminded nightmare elm street remember telephone coming alive keep watching flick waiting happening next viewable freak cause gore said blood neither nudity pervert seen worser movie one wished made bloodier,0
getting lost space frozen year unlikely falling star improbable falling day go supernova explodes ludicrous getting rescued ship priceless br br zaphod beeblebrox heart gold rescue also parent year awardees sentencing daughter two year solitary confinement abandoned spaceship mother encourages get drunk wander alone strange man picked foreshadows prowess hand hand combat make film action combat highlight include example psycho talking close face face one woman blindly pointing gun behind six inch away obligingly simper line fire br br end family three abandon metropolis sized ship planning use observe supernova last instant slow escape blast wave instead using psycho fighter ship refueled one minute pound gas propellant kiloton missile love hard sci fi statistic br br long hollywood treat writing irrelevant frill continue making movie fit run sci fi channel,0
think time seagal go quietly night seen make direct video release last year look like early smash hit comparison br br secret bio lab making new kind drug jack human adrenaline system point become psychopathic killer something somehow seagal supposed stop infection end world something seagal also went hit squad like jellybeans every time look commanding new face kinda got hard follow character development well know steven athsma prevent yelling top lung even constantly dubbed people sound nothing like usually film plot action sequence save total waste time even close like said horror movie lot blood shank stabbing rather straight fighting problem really scary seagal looked completely place infected people supposed speed light movement yet year old lb seagal killed singlehandedly guess lone highlight movie first minute new recruit ask seagal come strip club br br,0
like big mechanical toy say character early commenting jaw well blood surf would wish beast convincing shark jaw series word digital special effect movie terrible acting directing much better either seem suited deodorant bubble gum commercial horror movie attitude people worked film show contempt genre audience saying liked film encourages filmmaker offer u crap destroying poor horror genre,0
intended light entertainment film indeed successful first half succumbs rapidly foundering script drop harry judd nelson reformed burglar daphne gina gershon aspiring actress employed live window mannequin department store one evening late leaving locked within whereupon witness le protective glass observation point apparent homicide occurring street ostensible murderer mile raymond nick mancuso local sculptor return following day observe mannequin since realizes possible witness prior night violent event one posing pair flinch fun begin daphne harry report observation local police station detective taking crime report remembers harry criminal background becomes cynical great many way film become hackneyed one manages utilize including obligatory slow motion bedroom scene passion low budget affair shot vancouver even police procedural aspect displayed rote always capable gershon try make something role mancuso incredibly histrionic bizarrely attack line obvious loose rein although film sag nonsense cinematographer glen macpherson prefers follow suit set camera lighting splendidly realised composition viewer may focus upon ignoring plot hole witless dialogue well crafted score appropriately based upon action contributed hal beckett mentioned dialogue initially somewhat fresh delivered well bantering manner nelson gershon subsequent context flawed continuity logic predictability take direction reflects lack original idea point view post production flaw set work back farther expected basic thriller,0
well made documentary focusing two sudanese refugee get resettled united state basic fish water story non fiction twist found fascinating see peter santino lived prior coming america adapted arrived houston texas expected sort heaven found lot harder look cope well state go hopeful idealist somewhat realistic skeptic everywhere go meet bureaucrat paper trail citizen may take granted fret blacker african american feel accepted one lost boy manages leave houston go olathe kansa find condition slightly better still le ideal people try help well try hurt film shown talked put gun head robbed leading one lost boy comment negatively black people america good found interesting arrived houston august month world trade center attacked terrorist hoped see reaction tragedy mentioned still really well done documentary narration none needed really lost boy fine job expounding event going around without help thank much,1
oh blockbuster movie simply stick selling point everyone cinema young old see talking animal make joke whilst happy lost space came two killer blow plot sentiment really cared happened tiger whether eddie murphy made daughter sure,0
disney bill paxton fine job conveying story based fact like game golf appreciate story one man struggle overcome odds could based sport simply situation involves competition though one happens related golf problem story would liked see bit deeper main character esp mr ouimet mr francis ouimet typical young man time turn century america class line well delineated woe anyone deigns try rise class standing bit historical research biggest question indeed answered satisfaction although circumstance bit different portrayed film came away feeling content thoroughly enjoyed movie believe,1
one funniest romantic musical movie ever definitely worth renting buying especially taste older style cinematography br br animal song alone make smile watching movie definite must madonna fan,1
earth become dear ramu man made sarkar satya comapny refuse believe aag ramu ambitious project clearly jumped high cliff ascended giving industry greatest work time movie made fall like brick cringing leave theater forced sit able take car parking lot others also left else nothing would made sit beyond interval br br movie nowhere close sholay even come near within mile believe ramu surely love godfather sholay since sarkar classic piece work read ramu interview couple day back interviewer said ramu sleep hour day stretch completely agree lack sleep probably taken toll movie br br power performance amitabh bachchan even look scary looked terrifying poster wallpaper saw earlier ramu favorite nisha kothari fantastic job sarkar many dialog fact none remember clearly opened mouth movie found place history new guy playing jai role seems brash look manage jai role cant go im sorry pain big manage right br br promised throughout movie watch original sholay see still br br bottom line horrible movie medium critic going cook ramu goose remind reader one biggest ramu fan even cant spare act,0
decide watch wild rebel expect anything deep meaningful looking film explores relationship structure motorcycle gang wild rebel wrong movie looking expose breakdown american educational system problem juvenile delinquency wild rebel wrong movie looking movie examines undermanned rural police department facing well financed well organized gang wild rebel wrong movie looking absurd movie filled scene scene unintentional humor horrendous acting paper thin plot community theater style production value wild rebel right movie br br wild rebel story luck stock car driver named rod tillman steve alaimo fiery crash rod walk away completely unscathed despite cotton pant london fog style jacket protection rod decides give plan future wander aimless back road south stumble satan angel motorcycle gang gang three stupidest guy ever zip leather jacket woman seem share group hoodlum spends time terrorizing rural town florida committing atrocity stealing newspaper neighbor mailbox bumbling idiot need someone act driver larger crime planned apparently three einstein drive vehicle two tire four recruit rod perform feat daring experienced stunt driver would capable like keeping car middle gravel road low speed chase eventually hold bank get aforementioned low speed chase lamest gun battle police ever put film could go forever get idea br br hate term bad good seems aptly describe wild rebel,0
go many heist comedy might care one actor made first saw year later almost similar happening even though obviously much le serious comedy one mafia figure take kidnapping rather turn different direction altogether course raquel welch play kind sharp character faye dunaway happening make sexist film either practically playing stock character almost version moll completely biased among first film ever saw time saw turn around without seeing poster luckily think robert wagner really right neither thoroughly likable dis likable leader group edward g robinson naturally vittoria de sica godfrey cambridge actor always managed funny,1
first time window opportunity see forgotten classic back early one art house revival watched fever dream exercise sexuality thought yowza got away murder europe back day unfortunately film heavily cut original u release blue nosed hayes office staunch government censorship board started holier thou bible thumper hayes former post office official believe due overall theme human sexuality heaven forbid human actually sex plot ecstasy concern young woman played hedy lamarr marries much older man later regret lamarr meet handsome younger man affair resulting divorce previous husband another hollywood movie back divorce despite fact film produced probably director first time working sound format e film seems posse technique used mostly silent film e expressionism still worth searching window early european talking picture along luis bunuel l age dor karl gustav dryer vampyre rated contains infamous nude swimming scene thinly veiled sexual reference would fare little pg today standard would easily landed dreaded x back existed,1
tricky thing play queen one hand actress majestic imperious show vulnerability tough situation well gathering courage resolution overcome odds since almost movie queen basic plot line br br emily blunt quite radiant victoria full performance like blame help feel like mill boon novel adaptation compared darker dramatic movie another young queen elizabeth hence blunt get run gamut queenly emotion least full extent since know young victoria see old victoria check mr brown br br jean marc vallee interesting choice director movie last c r z excellent propelled fame quite different movie remember looking gorgeous probably main similarity two movie vallee wrote c r z one julian fellowes though really enjoyed gosford park story movie much le interesting soon got lost governmental politics maybe le engaging potential beheading monarchy saying,1
shakespeare fan appreciate ken branagh done bring shakespeare back new generation viewer however movie fall short conveying overall intention play ridiculous musical sequence add alicia silverstone stumbling dialogue reminiscent keanu reef much ado nothing poorly cast role equal excruciating endurance viewing,0
waterdance main character waterdance played eric stoltz find rehab center others similarly injured must face harsh new life confined wheelchair interesting promising premise unfortunately fails deploy ensues instead largely hollywood schmaltz interesting moment certainly cast eric stoltz william forsythe wesley snipe et al brilliant perform well one would expect talent wasted character mainly stereotype one kind another thoroughly unlikeable snipe character exception suppose kind attempt break people idea handicapped crippled weak depicting part face prick make entirely annoying experience admittedly show something permanent disability go way softened romanticized useful good idea process depicted make one difficult person get along worth dealing part parcel character must varying degree despicable disneyfied either surely middle ground somewhere film conclusion eric stoltz character come accept status handicapped person since flaming narcissistic monster beginning film end care le br br addition character problem film suffers weird syndrome many hollywood movie suffer syndrome really official name might call inexplicable forgiveness syndrome go something like character abuse crap without much apology forgiven especially obnoxious example movie breakfast club one character spends film verbally bullying everybody within earshot result love one latest example spiderman supervillain sandman lay waste chunk manhattan wail spiderman seems like monotonous minute waved amount bye egregious example ifs waterdance sequence called n word william forsythe racist biker character friend previous scene wesley snipe character whoop forsythe character next scene nothing happened short time hence without much oh yeah sorry business back know called n word make wonder people actually watch movie release film eye closed kind slap together editing room according scene number call day work,0
poor film must give lead actress one francine forbes appeared acting least personally thought kind cute bad appears one film database besides film filled laughable gore fakey death scene people get stabbed gush like gallon blood like watch poor horror film recommend one highly,0
film version sandra bernhard one woman broadway show gaspingly pretentious sandra spoof lounge act superstar sense irony fitfully interesting fitfully funny fan say scathingly honest may true also shrill unapologetic face bravado well suited film genre want make nice certainly make friend always going rub lot people wrong way even meet halfway material seriously lacking filmmaker nicolas roeg served executive producer though directed film chilly detached signature style bernhard co wrote show director john boskovich oddest touch sandra house audience looking completely bored feeling many real viewer likely share,0
read biography lincoln maybe accurate portrayal br br maybe used equally alienating unrealistic worshiping portrayal unnaturally deify lincoln brilliant honorable savior country br br would make movie representing lincoln buffoon henry fonda made excellent lincoln portrayal aw shuck simple guy seemed little insulting br br granted bushie jr whole campaign make u think regular guy care rich privileged moron whole story br br film show lincoln sort simple almost simple minded kind guy film state lincoln sort got law accident even interested law falsely simplistic idea law right wrong film good defense attorney lounge around foot table make fun witness outcome mostly determined chance luck br br furthermore partly financed republican reaction play sponsored democrat come partly sentiment time film unfortunately religious racist conservative br br waste time film,0
second film interesting previous one except suspense know going going happen even hinted screen pleasure come way various trick happen succession know dynamite car lose wheel car crash speak car happens detail particular discover film may baited dumb woman obvious come know already seen know dragged trap going get must discover worry get main trafficker another story speed boat match busy beaver river also know going wounded know bullet proof jacket day true recently discovered gi kind equipment iraq meaning film insistence hunting trafficker blindness see prohibition creates problem film constant perfect illustration value ever stand way moralistic crusade force evil simply legalize good properly observed surveillance something illegal pushed way le fun use forbidden restricted attractive br br dr jacques coulardeau university paris dauphine university paris pantheon sorbonne university versailles saint quentin en yvelines,1
saw one stage performance denver never le impressed word vagina say body part nothing shocking could say doctor left arm hurting bit tennis vagina hurt cycling equal social commentary could tricep monologue entertainment radical comment heard monologue dull delivered drama topic outdated alternately bored annoyed think laughed apparently supposed surely really hit oh spoiler lesbian oh wait maybe come think inappropriate fondling crack mama cover,0
first watched show cartoon network found uninteresting read lot good message show decided watch show boring episode predictable show logic hypersmart girl going school sometimes stupid thing episode start monster attacking townswille mayor real fool funny stupid imagine became mayor professor yes supposed smartest person show actually even found difference monster brother narrator comment also make show boring also similar line beginning episode ending also animation strange everything except main hero shown ugly way also every epsode show giving life lesson mean oriented little child look closer see lot violence even blood battle,0
movie george c scott best bernard hughes best diana rigg pithy course paddy chaevsky writing masterpiece warp also brief snippet future biggies like susan sarandon stockard channing etc one scene line necessarily spot fifth sixth time watching nancy marchand young middle age nurse supervisor also superb well practically every face hollywood br br one movie get better time see watch surprise scene ala wait dark one movie ever bought dvd superb,1
normally glutton poor movie thing stunk br br watch movie br br terrible effect little humour hell point making movie gore speak acting speak br br could manage minute rat dropping movie rare br br something positive say drivel cover art ok pretty sure movie ending even tho make br br rat unorganized blew line constantly lacked intensity seemed going pace paycheque actor worse,0
ya know idea everybody else teenage life reflect folk knew hung around let alone case wondering pristine clean cut pat boone type teen ever thing br br look saying teenager easy better well actually best teen movie time fast time ridgemont high kid knew realistic got back maybe br br crap low rent version fast time even much moment enough recommend even claim teen back relate lead girl girl nothing please really wanted keep virginity would case film would made pure crap bad staple left behind time capsule cinema teen young adult early,0
